755,Best of Tasmania,"The wild and wondrous island state of Tasmania stands apart from the rest of Australia in ways beyond mere geography. A great option for travellers who’ve already explored mainland Australia (including Aussies themselves) and are in the market for something a little different, this trip opens up the bountiful, untamed wilderness with a bundle of hands-on active pursuits. Go kayaking, jet-boating and fishing near Strahan, check out Cradle Mountain, Cataract Gorge, the eye-poppingly scenic Bay of Fires and meet some genuine Tasmanian devils at a wildlife sanctuary. It’s different down here. Discover why.",8,https://gadventures.b.ssl.fastly.net/media-server/dynamic/admin/maps/2014/OATS.png,https://gadventures.b.ssl.fastly.net/media-server/dynamic/admin/trip-banners/australia-pacific/australia/OATS/Australia-Tasmania-Wineglass-Bay-Landscape-IS-12521177-Lg-RGB-OATS.jpg,165,2014-07-05 18:13:46 UTC,2014-07-05 18:13:46 UTC
756,Highlights of New Zealand,"Two weeks is barely enough time to thoroughly explore your hometown, let alone a place as fascinating as New Zealand. For adventurers on a tight time-budget, this 15-day trip wraps up the must-dos of both islands with a nice little bow. Check out the Coromandel's gorgeous beaches, hang with the Maori in a traditional village, walk the black sand beaches of Kaikoura and get your adrenaline fix in Queenstown. Consider this your New Zealand Starter’s Kit.",15,https://gadventures.b.ssl.fastly.net/media-server/dynamic/admin/maps/2014/ONAC.png,https://gadventures.b.ssl.fastly.net/media-server/dynamic/admin/trip-banners/australia/new-zealand/ONIS/ONIS-New-Zealand-Queenstown-City-Night-Mountain-IS-7829970-Or-RGB.jpg,166,2014-07-05 18:13:46 UTC,2014-07-05 18:13:46 UTC
757,Active New Zealand,"If you're travelling to New Zealand, you wouldn't want to have to choose between the two islands. With all the activities you can choose from in each country, then you want to make the most of the chance to lose your breath. Across three weeks on two islands you can hike, kayak, cycle across this diverse land. There's also time for boat cruises and local culture, just to be sure you don't miss out on anything.",21,https://gadventures.b.ssl.fastly.net/media-server/dynamic/admin/maps/2014/ONAP_1.png,https://gadventures.b.ssl.fastly.net/media-server/dynamic/admin/trip-banners/australia-south-pacific/new-zealand/ONNS/ONNS_banner_new_zealand_landscape_crater_lake.jpg,166,2014-07-05 18:13:47 UTC,2014-07-05 18:13:47 UTC
758,New Zealand—The Bay of Islands,"Nature lovers who leave the North Island without stopping in at the Bay of Islands will kick themselves all the way back home (and that’s a looooong flight). This 4-day trip to this outdoorsman’s paradise features ample time hiking the nature trails and makes the most of all that water with plenty of opportunities for swimming, snorkelling, kayaking and sailing. Not enough? A night aboard a houseboat should do the trick. We take care of all the fuss. All you have to do is have the time of your life.",4,https://gadventures.b.ssl.fastly.net/media-server/dynamic/admin/maps/2013/ONBI.png,https://gadventures.b.ssl.fastly.net/media-server/dynamic/admin/trip-banners/australia/new-zealand/ONBI/ONBI-New-Zealand-Abel-Tasman-Sea-Female-Kayak-Cliff-IS-15341685-Or-RGB.jpg,166,2014-07-05 18:13:47 UTC,2014-07-05 18:13:47 UTC
759,New Zealand in Style,"An all-encompassing yet comfortable journey through New Zealand that delivers the highlights of the region with stye to spare. Utilizing a diverse range of transport—trains, gondolas, boats—you’ll explore artsy beach towns, learn about local myths, legends and traditional cuisine from the Maori and revel in the breathtaking beauty of New Zealand. Handpicked accommodations and upgraded transportation are standard fare on this decidedly non-standard adventure. This trip offers everything you could possibly want... and then some.",11,https://gadventures.b.ssl.fastly.net/media-server/dynamic/admin/maps/2013/ONIS.png,https://gadventures.b.ssl.fastly.net/media-server/dynamic/admin/trip-banners/australia/new-zealand/ONIS/ONIS-New-Zealand-Queenstown-City-Night-Mountain-IS-7829970-Or-RGB.jpg,166,2014-07-05 18:13:48 UTC,2014-07-05 18:13:48 UTC
760,New Zealand - Active North Island,"The North Island of New Zealand is blessed with spectacular scenery, ranging from bubbling thermal pools to fast flowing rivers. The best way to see all of this? Get up close and personal. This itinerary includes biking out to the mud pools and thermal waters of Hotwater Beach, hiking the Tongariro Crossing - one of the world's most famous one day hikes - before jet boat and canoes provide the transport along the Whanganui River. Mix in some wild food, a traditional Hangi dinner and some hot spa action and this is the perfect active introduction to New Zealand.",8,https://gadventures.b.ssl.fastly.net/media-server/dynamic/admin/maps/2014/ONNA.png,https://gadventures.b.ssl.fastly.net/media-server/dynamic/admin/trip-banners/australia-south-pacific/new-zealand/ONSS/ONSS_banner_new_zealand_landscape_mounton_lake.jpg,166,2014-07-05 18:13:48 UTC,2014-07-05 18:13:48 UTC
761,New Zealand - North Island Encompassed,"New Zealand’s North Island thoroughly engages the body and the spirit, often at the same time. This 10-day trip promises loads of both. Up here, you’ll learn Maori culture (and try your hand at bone-carving) straight from the source while bunking in villages in the bush and pick up some sustainable living tips on a conservation farm. Elsewhere, you’ll sea kayak in a secluded harbour, get a surfing lesson from an expert and camp out in a retro-style caravan. There’s much more, but we’ve gotta leave some surprises, right?
",10,https://gadventures.b.ssl.fastly.net/media-server/dynamic/admin/maps/2013/ONNE.png,https://gadventures.b.ssl.fastly.net/media-server/dynamic/admin/trip-banners/australia/new-zealand/ONIS/ONIS-New-Zealand-Queenstown-City-Night-Mountain-IS-7829970-Or-RGB.jpg,166,2014-07-05 18:13:49 UTC,2014-07-05 18:13:49 UTC
762,New Zealand—Best of the North Island,"Admittedly, we haven’t checked the numbers too closely, but we’re confident that New Zealand ranks among the world’s leading producers of excitement. This quick trip across the North Island jams as many thrills as permissible by law into seven electrifying, activity-packed days. Sea kayak remote waterways to secluded caves and beaches, learn to surf New Zealand's world famous waves, experience Maori culture directly from the Maori themselves and more, all in a breezy week that always feels full and never feels hurried.",7,https://gadventures.b.ssl.fastly.net/media-server/dynamic/admin/maps/2013/ONNI.png,https://gadventures.b.ssl.fastly.net/media-server/dynamic/admin/trip-banners/australia/new-zealand/ONNI/ONNI-New-Zealand-Maori-Wood-Sculpture-IS-2804806-Or-RGB.jpg,166,2014-07-05 18:13:49 UTC,2014-07-05 18:13:49 UTC
763,Best of New Zealand,"Compared with their enormous western neighbour, the islands of New Zealand don’t look especially big on the map, but don’t let their small stature deceive you. There is much, much, much to do here, be it biking to old gold mining sites, kayaking remote coves and some of the most breathtaking hiking routes in the whole world. But if you’re short on travel dollars, fear not; this trip squeezes in the very best of both the North and South islands into an affordable, action-packed 21-day itinerary that moves swiftly without ever seeming rushed.",21,https://gadventures.b.ssl.fastly.net/media-server/dynamic/admin/maps/2013/ONNS.png,https://gadventures.b.ssl.fastly.net/media-server/dynamic/admin/trip-banners/australia/new-zealand/ONIS/ONIS-New-Zealand-Queenstown-City-Night-Mountain-IS-7829970-Or-RGB.jpg,166,2014-07-05 18:13:49 UTC,2014-07-05 18:13:49 UTC
764,New Zealand Encompassed,"It dosen’t look so big on the map, but New Zealand is positively massive once you’re there in person. This comprehensive 24-day trip—our longest in this part of the world—delivers the most immersive NZ experience possible. Get close to the land by exploring volcanoes, national parks, sustainable farms, and meet the water up-close on expert-led kayak excursions and during surf lessons. Best of all, you’ll get to explore the magnificent Bay of Islands, home to some of the world’s top fishing. 24 days? You’ll wish it was longer.",24,https://gadventures.b.ssl.fastly.net/media-server/dynamic/admin/maps/2013/ONNZ.png,https://gadventures.b.ssl.fastly.net/media-server/dynamic/admin/trip-banners/australia/new-zealand/ONIS/ONIS-New-Zealand-Queenstown-City-Night-Mountain-IS-7829970-Or-RGB.jpg,166,2014-07-05 18:13:50 UTC,2014-07-05 18:13:50 UTC
765,New Zealand - Active South Island,"New Zealand is the perfect place for adrenaline and activity, and there's nowhere in the country more suited to that than the South Island. On this two-week trip, cover the ground (or water) by sea kayak, boat, bike, and on foot. Explore Abel Tasman National Park, hike the Routeburn Track, glide along the waters of Milford Sound and take two wheels through the Rail Trail in Central Otago. If you're not out of breath just from reading all that, then it's time to start packing.",15,https://gadventures.b.ssl.fastly.net/media-server/dynamic/admin/maps/2014/ONSA_1.png,https://gadventures.b.ssl.fastly.net/media-server/dynamic/admin/trip-banners/australia/new-zealand/ONNE/ONNE-New-Zealand-Tongariro-Female-Backpacker-Hiking-IS-11483870-Or-RGB.jpg,167,2014-07-05 18:13:51 UTC,2014-07-05 18:13:51 UTC
766,New Zealand—South Island Encompassed,"Looking to tackle a bundle of different environments all in one go? New Zealand’s South Island has what you need and then some. Action is the common thread throughout this trip that incorporates hiking, kayaking, cycling and even bungee jumping across a variety of landscapes, including rainforests, glaciers and some of the most gorgeous coastline you’ll ever see. This trip is exciting even when you’re not moving; accommodations include a seasonal floating boat hostel and a wilderness hostel deep in the rainforest itself. Unique? You bet.",15,https://gadventures.b.ssl.fastly.net/media-server/dynamic/admin/maps/2014/ONSE.png,https://gadventures.b.ssl.fastly.net/media-server/dynamic/admin/trip-banners/australia-south-pacific/new-zealand/ONNS/ONNS_banner_new_zealand_landscape_crater_lake.jpg,167,2014-07-05 18:13:51 UTC,2014-07-05 18:13:51 UTC
767,"Amazon To The Andes & Galapagos, North Islands","Hike the Inca Trail to the Lost City of Machu Picchu, explore the steamy Amazon from the comfort of our intimate 'G Tambopata Ecolodge’ and spend five nights aboard our exclusive g1 vessel, snorkelling the waters of the Galapagos—experience the iconic highlights of South America in one incredible adventure. Our exclusively operated fleet of yachts offers great value—and because we run our own treks, we can ensure the fair treatment of our porters and the quality of food and equipment as you follow the Inca Trail to majestic Machu Picchu.",18,https://gadventures.b.ssl.fastly.net/media-server/dynamic/admin/maps/2012/PA07PA.jpg,https://gadventures.b.ssl.fastly.net/media-server/dynamic/admin/trip-banners/south-america/amazon/PA07PA/PA07PA.jpg,135,2014-07-05 18:13:52 UTC,2014-07-05 18:13:52 UTC
768,"Amazon to the Andes & Galapagos, Western Islands","Experience the iconic highlights of South America in one incredible adventure. Hike the Inca Trail to the Lost City of Machu Picchu, explore the steamy Amazon from the comfort of our intimate G Lodge Amazon, spend seven nights exploring the Galápagos aboard the Daphne and snorkel the waters of the Galápagos. Our exclusively operated fleet of yachts offers great value and in Peru, we run our own treks, ensuring the fair treatment of our porters and the quality of food and equipment as you follow the Inca Trail to majestic Machu Picchu.",21,https://gadventures.b.ssl.fastly.net/media-server/dynamic/admin/maps/2014/PA10HA.png,https://gadventures.b.ssl.fastly.net/media-server/dynamic/admin/trip-banners/south-america/peru/PID/PID_banner_peru_wildlife_sillustani_alpaca.jpg,135,2014-07-05 18:13:52 UTC,2014-07-05 18:13:52 UTC
769,Amazon To The Andes,"This adventure offers up an intriguing combination of beauty and contrasts in scenery, wildlife and cultures—whether you’re scanning the canopy for wildlife from the comfort of our intimate and exclusive 'G Lodge Amazon’ or climbing the ancient trail of the Incas to Machu Picchu, situated in the heavens of the Americas. Because we run our own treks, we can ensure the fair treatment of our porters and the quality of food and equipment so that you’re free to enjoy the beauty of the region.",12,https://gadventures.b.ssl.fastly.net/media-server/dynamic/admin/maps/2012/PAA.jpg,https://gadventures.b.ssl.fastly.net/media-server/dynamic/admin/trip-banners/south-america/peru/PAA/PAA_banner_peru_amazon_wildlife_toucans.jpg,135,2014-07-05 18:13:52 UTC,2014-07-05 18:13:52 UTC
770,Essence Of Peru,"This adventure has it all—explore the awe-inspiring Amazon from the comfort of our intimate and exclusive 'G Tambopata Ecolodge’ and embrace cultures past and present in Cusco where you’ll have lots of time to explore ruins, museums and markets. Delight in the views of the Sacred Valley from the comfort of your coach as you travel by rail to Machu Picchu. With years of experience, we employ the best local guides, so that you’re free to enjoy the beauty of the region.",14,https://gadventures.b.ssl.fastly.net/media-server/dynamic/admin/maps/2012/PEE.jpg,https://gadventures.b.ssl.fastly.net/media-server/dynamic/admin/trip-banners/south-america/peru/PEE/PEE_banner_peru_people_tourist_woman_with_native_child.jpg,135,2014-07-05 18:13:53 UTC,2014-07-05 18:13:53 UTC
771,Inca Explorer,"Spot wildlife, explore Inca culture and marvel at the mystery of the Nazca Lines. This tour of Peru’s highlights is perfect for those wishing to explore its cultural and historical treasures. Meet the vibrant local people of Lake Titicaca and delight in views of the Sacred Valley from the comfort of your coach as you travel by rail to Machu Picchu. Taking the train will allow you lots of time to explore ruins, museums and markets. With years of experience, we directly employ the best local guides so that you’re free to enjoy the beauty of the region and its people.",15,https://gadventures.b.ssl.fastly.net/media-server/dynamic/admin/maps/2012/PEI.png,https://gadventures.b.ssl.fastly.net/media-server/dynamic/admin/trip-banners/south-america/peru/PEI/PEI_banner_peru_landscape_alpaca_in_front_of_ruins.jpg,135,2014-07-05 18:13:53 UTC,2014-07-05 18:13:53 UTC
772,Taste Of Peru,"If you’re looking to savour Peru’s highlands but don’t want to miss its Amazon region, this adventure tops the menu—in comfort and style. After taking in your fill of Amazonian wildlife from the comfort of our intimate and exclusive 'G Lodge Amazon’, embrace cultures past and present in Cusco where you’ll have lots of time to explore ruins, museums and markets. Finally, delight in the sweet views of the Sacred Valley from the comfort of your coach as you travel by rail to Machu Picchu. With years of experience, we employ the best local guides, ensuring that you’re free to enjoy the beauty of the region.",10,https://gadventures.b.ssl.fastly.net/media-server/dynamic/admin/maps/2012/PET.jpg,https://gadventures.b.ssl.fastly.net/media-server/dynamic/admin/trip-banners/south-america/peru/PET/PI06G_banner_peru_activity_hiking_machu_picchu_pax.jpg,135,2014-07-05 18:13:53 UTC,2014-07-05 18:13:53 UTC
773,Absolute Peru & Galapagos North & Central Islands,"Explore Peru's southern coast and its Incan Highlands. From the soaring heights of the Inca Trail to the steamy jungle stay at the exclusive G Lodge Amazon, this epic journey includes an all-encompassing tour of Peru and four nights exploring the Galápagos. As one of the biggest tour operators in the region, our exclusively operated fleet of yachts offers great value, and in Peru, we run our own treks, ensuring the fair treatment of our porters and the quality of food and equipment as you follow the Inca Trail to majestic Machu Picchu.",27,https://gadventures.b.ssl.fastly.net/media-server/dynamic/admin/maps/2014/PH07HB.png,https://gadventures.b.ssl.fastly.net/media-server/dynamic/admin/trip-banners/south-america/peru/TSPITT/TSPIDN_inca_indie.jpg,135,2014-07-05 18:13:54 UTC,2014-07-05 18:13:54 UTC
774,"Peru Hike, Bike & Raft","Perfect for the active adventurer looking for a challenge, this trip will have you hiking, biking and paddling through Peru's Andes Mountains and into the jungle below. Conquer a whitewater river by raft and hike the Inca Trail to the cloud forest citadel of Machu Picchu and spectacular views. Tear it up on mountain bikes on a descent into the Manu Cloud Forest, raft wild rivers and get your adrenaline pumping on exciting optional excursions.",16,https://gadventures.b.ssl.fastly.net/media-server/dynamic/admin/maps/2012/PHB.jpg,https://gadventures.b.ssl.fastly.net/media-server/dynamic/admin/trip-banners/south-america/peru/PHB/PHB_banner_peru_activity_biking.jpg,135,2014-07-05 18:13:54 UTC,2014-07-05 18:13:54 UTC
775,Highlands & Amazon Adventure,"If you’re looking to explore the Andean highlands—including the Inca Trail—but don’t want to miss Peru’s Amazon, this tour offers packs an intriguing combination of natural wonders and cultural highlights. Scan the canopy for wildlife from the comfort of our intimate and exclusive 'G Tambopata Ecolodge’ before encountering vibrant Andean culture steeped in ancient traditions. Conquer one of the world’s best known hikes on your way to the majestic views of Machu Picchu before heading on to explore the pre-Inca ruins of Tiahuanaco in Bolivia. As the region’s largest operator, we run our own treks, which ensures the fair treatment of our porters, quality food, service and equipment.",15,https://gadventures.b.ssl.fastly.net/media-server/dynamic/admin/maps/2012/PHML.jpg,https://gadventures.b.ssl.fastly.net/media-server/dynamic/admin/trip-banners/south-america/peru/PHML/PHML_banner_peru_woman_with_hat.jpg,135,2014-07-05 18:13:55 UTC,2014-07-05 18:13:55 UTC
776,Highlights Of Peru,"This odyssey digs deep into the geography, culture and history of Peru, offering you an intriguing combination of guided excursions and free time to explore at your own pace. You’ll have the opportunity to soar above the Nazca lines, scan the canopy for wildlife from the comfort of our exclusive ‘G Tambopata Ecolodge’, cruise on Lake Titicaca, dine with locals at a homestay and delight in the views of the Sacred Valley as you travel by rail to Machu Picchu.",21,https://gadventures.b.ssl.fastly.net/media-server/dynamic/admin/maps/2012/PHP.jpg,https://gadventures.b.ssl.fastly.net/media-server/dynamic/admin/trip-banners/south-america/peru/PHP/PHP_banner_peru_activity_hiking_through_montains.jpg,135,2014-07-05 18:13:55 UTC,2014-07-05 18:13:55 UTC
777,Absolute Peru,"Scan the canopy for wildlife from the comfort of our intimate and exclusive 'G Lodge Amazon’, contemplate mountain vistas or take an optional flight over the Nazca Lines—this epic journey explores the geography, culture and history of Peru, offering you the perfect blend of guided excursions and free time. Hike the Inca Trail, which rewards those willing to break a sweat with stunning vistas of ruins, mountainscapes and cloud forest. And because we run our own treks, we can ensure the fair treatment of our porters and the quality of food, service and equipment.",21,https://gadventures.b.ssl.fastly.net/media-server/dynamic/admin/maps/2012/PHPT.jpg,https://gadventures.b.ssl.fastly.net/media-server/dynamic/admin/trip-banners/south-america/peru/PHPT/PHPT_banner_peru_people_man_in_front_of_alpacas.jpg,135,2014-07-05 18:13:55 UTC,2014-07-05 18:13:55 UTC
778,Inca Discovery,"Perfect for those looking to experience the region’s archeological and cultural treasures in a short amount of time, this adventure includes a four-day trek along the Inca Trail. This is one of the world’s best known hikes and will reward those willing to break a sweat with a stunning combination of mountainscapes, cloud forests and jungles. We run our own treks, which ensures the fair treatment of our porters and quality equipment. Our knowledgeable CEOs will work hard to make certain the first glimpse of Machu Picchu will burn itself into your memory.",8,https://gadventures.b.ssl.fastly.net/media-server/dynamic/admin/maps/2012/PID.jpg,https://gadventures.b.ssl.fastly.net/media-server/dynamic/admin/trip-banners/south-america/peru/PID/PID_banner_peru_wildlife_sillustani_alpaca.jpg,135,2014-07-05 18:13:56 UTC,2014-07-05 18:13:56 UTC
779,Peru Family Adventure,"Take your family vacation to new heights on this 10-day journey through Peru. Wander the ancient streets of Cusco where the ghosts of history mingle with modern Incan culture. Then take a train ride through the clouds to the Lost City of Machu Picchu for incredible views and an experience you'll never forget. Aftwerward, explore the steamy Amazon jungles from the comfort of our intimate and exclusive 'G Tambopata Ecolodge’. A perfect mix of education, exploration and fun, this adventure will make explorers of the whole family!",10,https://gadventures.b.ssl.fastly.net/media-server/dynamic/admin/maps/2012/PIF.jpg,https://gadventures.b.ssl.fastly.net/media-server/dynamic/admin/trip-banners/south-america/peru/PIF/PIF_banner_peru_people_textiles_.jpg,135,2014-07-05 18:13:56 UTC,2014-07-05 18:13:56 UTC
780,Inca Discovery—Lares,"Perfect for those looking to experience the region’s archeological and cultural treasures in a short amount of time. Along with a visit to the cloud forest citadel of Machu Picchu, this trip will reward you with an intriguing combination of mountainscapes and a four-day Lares trek—a less-travelled but equally rewarding and challenging alternative to the classic Inca Trail. Because we run our own treks, we can ensure the fair treatment of our support staff and the quality of food and equipment so that you’re free to enjoy a glimpse into the rural communities of the highlands around Cusco.",8,https://gadventures.b.ssl.fastly.net/media-server/dynamic/admin/maps/2012/PIL.jpg,https://gadventures.b.ssl.fastly.net/media-server/dynamic/admin/trip-banners/south-america/peru/PIL/PIL_banner_peru_landscape_mountain_river.jpg,135,2014-07-05 18:13:56 UTC,2014-07-05 18:13:56 UTC
781,Inca Discovery Plus,"Like our ‘Inca Discovery’ tour but with a flight back to Lima, this trip offers a fascinating combination of the region’s archeological and cultural treasures. Retrace the steps of the Inca on a four-day trek along the Inca Trail to Machu Picchu. One of the world’s best known hikes, it will reward those willing to break a sweat with stunning views of ruins and cloud forests. We run our own treks, which ensures fair treatment of our porters and quality equipment. Our expert CEOs will make certain the first glimpse of Machu Picchu from the Sun Gate will burn itself into your memory.",9,https://gadventures.b.ssl.fastly.net/media-server/dynamic/admin/maps/2012/PIM.jpg,https://gadventures.b.ssl.fastly.net/media-server/dynamic/admin/trip-banners/south-america/peru/PIM/PIM-womens-weaving.jpg,135,2014-07-05 18:13:57 UTC,2014-07-05 18:13:57 UTC
782,Inca Empire,"From the cosmopolitan flair of Lima to Incan culture high in the Andes, this two-week adventure provides panoramic view of Peru and a glimpse of Bolivia. Embrace cultures past and present in Cusco and La Paz and interact with locals from the region’s communities for an immersive experience that few rarely get to know. Conquer the Inca Trail, one of the world’s best known and challenging hikes and experience the stunning views of majestic Machu Picchu. As the region’s largest operator, we run our own treks, which ensures the fair treatment of our porters, quality food, service and equipment.",15,https://gadventures.b.ssl.fastly.net/media-server/dynamic/admin/maps/2012/PIML.png,https://gadventures.b.ssl.fastly.net/media-server/dynamic/admin/trip-banners/south-america/peru/PIML/PIML_banner_peru_landscape_ruins_machu_picchu.jpg,135,2014-07-05 18:13:57 UTC,2014-07-05 18:13:57 UTC
783,Inca Heartland & Amazon,"From the Nazca Lines and the archeological and cultural treasures of the Andean highlands, this 3-week adventure explores the heartland of the Inca Empire and Peru’s Amazonian lowlands. Scan the canopy for wildlife from the comfort of our intimate and exclusive 'G Lodge Amazon’, embrace culture past and present in Cusco, sail Lake Titicaca and trek to the stunning ruins of Machu Picchu. As the region’s largest operator, we run our own treks, which ensures quality food and equipment. And, with the services of a CEO and your accommodation and transport taken care of, you can focus on exploring the region’s treasures for an immersive experience that few rarely get to know!",21,https://gadventures.b.ssl.fastly.net/media-server/dynamic/admin/maps/2012/PJML.jpg,https://gadventures.b.ssl.fastly.net/media-server/dynamic/admin/trip-banners/south-america/peru/PJML/TSPLLC_banner_peru_activity_boat_trip.jpg,135,2014-07-05 18:13:57 UTC,2014-07-05 18:13:57 UTC
