297,Delta and Falls Discoverer,"This classic trip showcases some of the best that Africa has to offer. Journey from Namibia and across Botswana and on to Zambia on an authentic African adventure that includes the elephants of Chobe National Park the mists of thundering Victoria Falls. Meet San Bushmen in the blazing Kalahari and explore the Okavango Delta by dugout mokoro canoe. With a knowledgeable CEO ensuring your accommodation provides the most authentic travel experience possible, you’ll overnight in bushmen huts and comfortable tents for an utterly unique experience. This tour is the trip of a lifetime.",9,https://gadventures.b.ssl.fastly.net/media-server/dynamic/admin/maps/2012/DADF.png,https://gadventures.b.ssl.fastly.net/media-server/dynamic/admin/trip-banners/africa/namibia/DADF/DADF_banner_namibia_cheetah.jpg,59,2014-07-05 18:10:21 UTC,2014-07-05 18:10:21 UTC
298,Botswana and Victoria Falls Adventure,"This Classic trip showcases some of the best that Africa has to offer. Journey from Namibia, across Botswana and on to Zambia on an authentic African adventure that includes the elephants of Chobe National Park. Meet San Bushmen in the blazing Kalahari and explore the Okavango Delta by dug-out mokoro canoe. With a knowledgeable CEO ensuring your accommodation will provide the most authentic travel experience possible, you’ll have an overnight in bushmen huts for an utterly unique experience. This tour is the trip of a lifetime.",8,https://gadventures.b.ssl.fastly.net/media-server/dynamic/admin/maps/2014/DADF.png,https://gadventures.b.ssl.fastly.net/media-server/dynamic/admin/trip-banners/africa/namibia/DADF/DADF_banner_namibia_cheetah.jpg,59,2014-07-05 18:10:22 UTC,2014-07-05 18:10:22 UTC
299,Cape & Dunes Overland,"Journey from the city streets of Cape Town to the desert of Namibia and experience the diversity of Africa on this classic adventure—Namibia is one of the world's most fascinating countries. Encounter a thrilling game drive through Etosha National Park and explore the world's highest sand dunes at Soussusvlei. Our unique overland truck will get you around smoothly and safely, while camping will keep you in the thick of the action. With guaranteed departures, plenty of optional excursions and a certified CEO to take care of the hassles, you’ll be free to absorb the spirit of this amazing country.",14,https://gadventures.b.ssl.fastly.net/media-server/dynamic/admin/maps/2013/DADO.png,https://gadventures.b.ssl.fastly.net/media-server/dynamic/admin/trip-banners/africa/namibia/DNCE/DNCE_banner_south_africa_pax_fish_river_canyon.jpg,58,2014-07-05 18:10:22 UTC,2014-07-05 18:10:22 UTC
300,Southern Africa Safari,"Visit the very best of South Africa, Botswana and Zambia in two action-packed weeks. Whether from the bow of a boat or the back of an open 4x4, our experts will improve your chances of getting ‘the’ shot. When on safari, our serviced tented camps are perfect for those who want the complete experience but prefer a more comfortable option—you’ll drift off to sleep to the soft calls of cranes and awake to the rustle of elephants grazing on nearby riverbanks. This trip isn’t just about the wildlife—it’s for those interested in cultural heritage, too. You’ll experience a meal in a South African home, tour Soweto in Johannesburg and join in a drum session in Livingstone. Experience all Southern Africa has to offer!",14,https://gadventures.b.ssl.fastly.net/media-server/dynamic/admin/maps/2012/DADSD.jpg,https://gadventures.b.ssl.fastly.net/media-server/dynamic/admin/trip-banners/africa/south-africa/DADSD/DADSD.jpg,58,2014-07-05 18:10:22 UTC,2014-07-05 18:10:22 UTC
301,South African Family Adventure,"Choosing the right trip for your family is tough. South Africa makes it ridiculously easy. Looking for a scenic drive? Check out the wonders along the fabled Panorama Route. Eager to spot the Big Five on the prowl? The national parks of Timbavati and Kruger are here to help. Curious about local history and traditional customs? Ask the villagers yourself. Fancy a swim or a stroll through the mountains? St Lucia and Drakensburg deliver. If variety is indeed the spice of life, South Africa may just be the world’s greatest spice cabinet.",12,https://gadventures.b.ssl.fastly.net/media-server/dynamic/admin/maps/2013/DAFA.png,https://gadventures.b.ssl.fastly.net/media-server/dynamic/admin/trip-banners/africa/south-africa/DAKFD/DAKFD_banner_south_africa_family_safari.jpg,57,2014-07-05 18:10:23 UTC,2014-07-05 18:10:23 UTC
302,"Dunes, Deltas & Falls Discoverer","This twenty-day journey through four African countries hits the highlights and is perfect for the adventurer who wants to discover the region’s diversity. Explore the Okavango Delta by dug-out mokoro canoe and marvel at the highest sand dunes in the world in the Namib Desert. Meet the San Bushmen of the Kalahari and feel the mist of thundering Victoria Falls. Your knowledgeable CEO will take care of the hassles and planning while you recharge in hotels, bushmen huts, camps and farm stays for a once-in-a-lifetime cultural experience you'll forever treasure.",20,https://gadventures.b.ssl.fastly.net/media-server/dynamic/admin/maps/2012/DAFD.jpg,https://gadventures.b.ssl.fastly.net/media-server/dynamic/admin/trip-banners/africa/namibia/DAFD/DAFD_banner_south_africa_sanddune_pax.jpg,58,2014-07-05 18:10:23 UTC,2014-07-05 18:10:23 UTC
303,Cape Town to Victoria Falls Adventure,"This 18-day journey through four African countries hits the highlights and is perfect for the adventurer who wants to discover the region’s diversity. Explore the Okavango Delta by dug-out mokoro canoe, marvel at the highest sand dunes in the world in the Namib Desert and meet the San Bushmen of the Kalahari. Your knowledgeable CEO will take care of the hassles and planning while you recharge in hotels, bushmen huts, camps and farm stays for a once-in-a-lifetime cultural experience you'll forever treasure.",18,https://gadventures.b.ssl.fastly.net/media-server/dynamic/admin/maps/2014/DAFD.png,https://gadventures.b.ssl.fastly.net/media-server/dynamic/admin/trip-banners/africa/namibia/DAFD/DAFD_banner_south_africa_sanddune_pax.jpg,58,2014-07-05 18:10:24 UTC,2014-07-05 18:10:24 UTC
304,"Delta, Falls & Kruger","From South Africa, through Botswana and into Zambia, track exotic wildlife across stunning scenery in comfortable vehicles and explore the Okavango by dug-out mokoro canoe. At night, fall asleep to the songs of the wilderness as you camp underneath big African skies. Our expert CEO will take the hassle out of planning and help you find the secluded spots only the locals know, leaving you free to enjoy the scenery and wildlife. From the teeming wilderness of Kruger National Park to the stunning views of legendary Victoria Falls, this is a true African adventure!",15,https://gadventures.b.ssl.fastly.net/media-server/dynamic/admin/maps/2012/DAFK.jpg,https://gadventures.b.ssl.fastly.net/media-server/dynamic/admin/trip-banners/africa/botswana/DAFK/DAFK.jpg,57,2014-07-05 18:10:24 UTC,2014-07-05 18:10:24 UTC
305,The Garden Route,"Mild temperatures, lush forests and supreme comfort aren’t what many people think of when they hear ‘Africa.’ But then again, most people never explore South Africa’s Western Cape. It’s their loss, really; this trip incorporates an unbeatable combination of beaches, coves, cuisine and accommodation. And there’s plenty of the other Africa on hand, too; the region’s ruggedly beautiful scenery guarantees you’ll get plenty of both the Africa you know—and the one you just fell in love with.",7,https://gadventures.b.ssl.fastly.net/media-server/dynamic/admin/maps/2012/DAGR.jpg,https://gadventures.b.ssl.fastly.net/media-server/dynamic/admin/trip-banners/africa/south-africa/DAGR/DAGR_banner_south_africa_cape_good_hope.jpg,58,2014-07-05 18:10:24 UTC,2014-07-05 18:10:24 UTC
306,Highlights of Southern Africa,"If you traced the Call of the Wild, it would originate in Southern Africa. This journey deep into the heart of the Dark Continent will get you closer to the fascinating wildlife and unfiltered natural beauty of this region than you’ve ever been before. Safari excursions in search of the ‘Big 5’ through Botswana and South Africa’s Kruger National Park and Timbavati Game Reserve form the backbone of this trip. And while the animals doze, you’ll have ample time to recharge in the intimate environs of Livingstone, Zambia.",16,https://gadventures.b.ssl.fastly.net/media-server/dynamic/admin/maps/2012/DAHS.jpg,https://gadventures.b.ssl.fastly.net/media-server/dynamic/admin/trip-banners/africa/south-africa/DAHS/DAHS.jpg,57,2014-07-05 18:10:25 UTC,2014-07-05 18:10:25 UTC
307,Joburg to Nairobi Overland,"Connecting two major hubs, this overland journey will take you from Johannesburg to Nairobi and into the stunning wilderness of the six countries that lie in between. Track Africa’s Big Five on game drives in the Serengeti and Ngorongoro and head to the Okavango Delta for a game walk and mokoro canoe excursion. Inhale the mists of Victoria Falls and the fragrant air of spice plantations in Zanzibar. You'll make your discoveries from a rugged overland truck, ready to take on Africa. Combine this with bush camping, a social atmosphere and a comprehensive itinerary and you have one hell of an adventure. ",27,https://gadventures.b.ssl.fastly.net/media-server/dynamic/admin/maps/2013/DAJB.png,https://www.flickr.com/photos/elosoenpersona/404980499/in/photolist-BMCAp-bCcMcF-e6eMPS-do7SaA-uRHm9-bUbZse-hZdy9k-dXpMWq-b7f6Gk-ubUBB-hU1cgy-nQnEGy-ZoPa1-5jdTCv-nKHZEh-5i9JWW-cZcS9J-g657YB-9vvVtk-7B1whA#,57,2014-07-05 18:10:25 UTC,2014-07-05 18:10:25 UTC
308,Southern Africa Encompassed,"When it comes to raw, in-your-face wildness, South Africa, Botswana, Zambia and Zimbabwe are incredible—from the vantage of our 16-seat minibus they are even more spectacular. Witness traditional dancing, explore the Okavango Delta with game walks and bush camping, track rhinos on foot in Zimbabwe’s Matobo National Park and capture the Big Five (with your camera, of course) in South Africa’s Kruger National Park. All the while, camping keeps you close to the incomparable scenery. This quick tour isn't simply a taste of Africa; it's a full-course meal—with seconds.",15,https://gadventures.b.ssl.fastly.net/media-server/dynamic/admin/maps/2013/DAJJ.png,https://gadventures.b.ssl.fastly.net/media-server/dynamic/admin/trip-banners/africa/botswana/DABV/DABV_banner_botswana_man_canoe.jpg,57,2014-07-05 18:10:26 UTC,2014-07-05 18:10:26 UTC
309,Botswana and Falls Adventure,"This trip offers a fully immersive, unyieldingly African experience in a compact 8-day package. Soak up the wildlife and vibrant colours and scenery of Zambia, Botswana and South Africa, with game walks and plenty of options for game drives. Camp under the stars of the Okavango Delta, track rhinos in the Khama Sanctuary and marvel at the immense Victoria Falls. Your nimble rugged overland truck will get you to the sites safely and camping will allow you to fall asleep to the sounds of the wild underneath big African skies. You'll end your adventure in Livingstone, where a G Adventures representative is there to assist you as you ease into the relaxed vibe.",8,https://gadventures.b.ssl.fastly.net/media-server/dynamic/admin/maps/2013/DAJL.png,https://gadventures.b.ssl.fastly.net/media-server/dynamic/admin/trip-banners/africa/botswana/DABV/DABV_banner_botswana_man_canoe.jpg,57,2014-07-05 18:10:26 UTC,2014-07-05 18:10:26 UTC
310,Joburg to Nairobi Adventure,"Connecting two major hubs, this overland journey will take you from Johannesburg to Nairobi—so that you can explore the stunning wilderness of the six countries that lie in between. Track Africa’s 'Big 5' on game drives across the plains of the Serengeti, Ngorongoro and Kruger and inhale the fragrant air of spice plantations in Zanzibar. A unique overland truck allows you to get to some less-visited areas of Africa, and participation camping will keep you at the heart of the action. With a comprehensive itinerary that offers plenty of exciting options, you’ll discover the diversity of wildlife, landscapes and people on this once-in-a-lifetime adventure.",28,https://gadventures.b.ssl.fastly.net/media-server/dynamic/admin/maps/2012/DAJN.jpg,https://gadventures.b.ssl.fastly.net/media-server/dynamic/admin/trip-banners/africa/zambia/DAJN/DAJN_serengeti.jpg,57,2014-07-05 18:10:27 UTC,2014-07-05 18:10:27 UTC
311,Joburg to Vic Falls Overland,"If time’s a little tight and you want to soak up the wildlife and vibrant colours and scenery of Zambia, Botswana and South Africa, this is the perfect expedition with plenty of options for game drives. Watch elephants gather at watering holes and hunt for the perfect snapshot of the ever-elusive 'Big 5' on a game drive in Kruger National Park. Our overland truck will get you to the sites safely and camping will allow you to fall asleep to the sounds of the wild underneath big African skies. With a unique itinerary that offers plenty of options, uncover all that southern Africa has to offer!",9,https://gadventures.b.ssl.fastly.net/media-server/dynamic/admin/maps/2012/DAJV.jpg,https://gadventures.b.ssl.fastly.net/media-server/dynamic/admin/trip-banners/africa/zambia/DAJV/DAJV_victoria_falls.jpg,57,2014-07-05 18:10:27 UTC,2014-07-05 18:10:27 UTC
312,Kruger Camping Adventure,"A classic five-day wilderness adventure that can be enjoyed on its own or as the perfect add-on to another trip. Track the 'Big 5' through the stunning wilderness of world-renowned Kruger National Park—one of the largest and most diverse wildlife areas in Africa. Add to the mix a visit to the village of Shalati to meet the beneficiaries of a Planeterra project, an up-close encounter with the region's rhythms, a traditional dinner—and you have a complete camping experience.",5,https://gadventures.b.ssl.fastly.net/media-server/dynamic/admin/maps/2012/DAKA.jpg,https://gadventures.b.ssl.fastly.net/media-server/dynamic/admin/trip-banners/africa/south-africa/DAKA/DAKA.jpg,57,2014-07-05 18:10:28 UTC,2014-07-05 18:10:28 UTC
313,Kruger & Cape Town,"South Africa’s seamless ability to blend unfiltered natural rawness and cosmopolitan creature comforts is equal parts accident and art. This trip takes you from the thriving urban culture and plush accommodations of the big cities to an authentic safari excursion in Kruger National Park and the Timbavati Game Reserve. Track the ‘Big 5’ with a team of skilled and knowledgeable CEOs by day, break for a delectable dinner, then hit the town in style at night. This is quintessential Africa.",9,https://gadventures.b.ssl.fastly.net/media-server/dynamic/admin/maps/2012/DAKC.jpg,https://gadventures.b.ssl.fastly.net/media-server/dynamic/admin/trip-banners/africa/south-africa/DAKC/DAKC.jpg,58,2014-07-05 18:10:28 UTC,2014-07-05 18:10:28 UTC
314,Kruger & the Garden Route,"Two wildly divergent—and equally authentic—sides of Africa, one incredible life-changing trip! Designed especially for the comfort-minded traveller, this adventure merges the world-famous wildlife of South Africa with the equally wondrous (and less-explored) natural grace of the fabled Garden Route over 12 extraordinary days. Wildlife excursions in Kruger National Park will bring you closer to the ‘Big 5’ than any nature documentary, and relaxing evenings spent sipping wine and dining in style on the glorious southeastern coast make for a truly unforgettable experience.",12,https://gadventures.b.ssl.fastly.net/media-server/dynamic/admin/maps/2012/DAKG.jpg,https://gadventures.b.ssl.fastly.net/media-server/dynamic/admin/trip-banners/africa/south-africa/DAKG/DAKG.jpg,58,2014-07-05 18:10:28 UTC,2014-07-05 18:10:28 UTC
315,"Kruger, Cape Town & Falls","The perfect African adventure for those who want to experience all of this region’s diverse pleasures quickly, authentically and comfortably, this 13-day trip has it all—and then some. Unfolding in three flight-assisted stages, this trip will take you from urbane Cape Town to the sprawling wilderness of Kruger National Park, home of the ‘Big 5’ and countless photo ops. From there, jet off to Livingstone, Zambia’s colonial jewel, and feel the awesome roar of Victoria Falls for yourself. Throughout, experienced CEOs will be on hand to draw out the best this magical land has to offer.",13,https://gadventures.b.ssl.fastly.net/media-server/dynamic/admin/maps/2012/DAKL.jpg,https://gadventures.b.ssl.fastly.net/media-server/dynamic/admin/trip-banners/africa/south-africa/DAKL/DAKL.jpg,58,2014-07-05 18:10:29 UTC,2014-07-05 18:10:29 UTC
316,Kruger Safari,"Savvy travellers know that a genuine African wildlife safari experience need not be all sweat and struggle. We built this six-day trip for adventurers who want to get right out into the thick of things with a minimum of fuss and a maximum of comfort. Here, you’ll tour South Africa’s famed Kruger National Park and Timbavati Game Reserve by day and dream of tomorrow’s encounters with the ‘Big 5’ from the coziest lodges available. With trusty CEOs at the ready, you’re free to focus on the important stuff, like squeezing that rhino into your viewfinder.",6,https://gadventures.b.ssl.fastly.net/media-server/dynamic/admin/maps/2012/DAKR.jpg,https://gadventures.b.ssl.fastly.net/media-server/dynamic/admin/trip-banners/africa/south-africa/DAKR/DAKR.jpg,57,2014-07-05 18:10:29 UTC,2014-07-05 18:10:29 UTC
317,Kruger Camping Safari,"Short and to the point, if you're already in Joburg or simply hungry for a taste of South Africa's exceptional wildlife and culture, this 4-day safari adventure will certainly hit the spot. Starting in Johannesburg, you'll head into world-renowned Kruger National Park—one of the largest and most diverse wildlife areas in Africa and home to zebras, elephants and lions. Travel is via a small 16-seat minibus. Participatory camping keeps you under the stars and, thanks to our long-standing community ties, you'll get plenty of invigorating local interaction as you meet the people of Shalati. The African wilderness is closer than you ever imagined.",4,https://gadventures.b.ssl.fastly.net/media-server/dynamic/admin/maps/2013/DAKS.png,https://gadventures.b.ssl.fastly.net/media-server/dynamic/admin/trip-banners/africa/south-africa/DAKS/DAKS_banner_africa_sunset_orange_trees.jpg,57,2014-07-05 18:10:30 UTC,2014-07-05 18:10:30 UTC
318,Kruger & Falls,"Enjoy a quick taste of southern Africa’s characteristic highlights on this brief-yet-comprehensive trip to South Africa and Zambia. It begins with a six-day safari expedition in Kruger National Park and the Timbavati Game Reserve—South Africa’s famed zoos without cages—where you’ll get the chance to see and photograph the ‘Big 5’ on their own turf. Later, you’ll jet off to Zambia for a date with the awesome spectacle that is Victoria Falls, the largest waterfall in the world. Finally, there’s time to unwind and absorb the experience along the banks of the Zambezi River in Livingstone.",10,https://gadventures.b.ssl.fastly.net/media-server/dynamic/admin/maps/2012/DAKU.jpg,https://gadventures.b.ssl.fastly.net/media-server/dynamic/admin/trip-banners/africa/south-africa/DAKU/DAKU.jpg,57,2014-07-05 18:10:31 UTC,2014-07-05 18:10:31 UTC
319,Kruger & Swaziland Adventure,"Eight thrill-packed days plus two dynamic and diverse countries equals one unforgettable adventure. This whirlwind tour of South African game parks and traditional villages in Swaziland crams the full majesty of Africa’s natural splendour and cultural diversity into the briefest of time frames. In and around Kruger National Park, you’ll join game drives and meet the people of Shalati, a small village transformed by a Planeterra school-building program. Later, you’ll experience Zulu hospitality as a guest of the chief in a remote village. Incredible wildlife? Check. Cultural immersion? Check and mate.",8,https://gadventures.b.ssl.fastly.net/media-server/dynamic/admin/maps/2012/DAKW.jpg,https://gadventures.b.ssl.fastly.net/media-server/dynamic/admin/trip-banners/africa/south-africa/DAKW/DAKW.jpg,57,2014-07-05 18:10:31 UTC,2014-07-05 18:10:31 UTC
320,Kruger & Swazi Overland,"In Africa, the cultural exchange rate is always favourable. This eye-opening journey into South Africa and Swaziland promises ample face-time with the region’s famed wildlife and life-changing contact with the people who make this land their home. Here, you’ll marvel at hippopotami in their natural habitat, dine on traditional cuisine prepared with care by villagers and meet the beneficiaries of Planeterra’s efforts in the region. And with a reliable team of knowledgeable CEOs on hand at all times, your comfort zone will expand by miles.",9,https://gadventures.b.ssl.fastly.net/media-server/dynamic/admin/maps/2012/DAKZ.jpg,https://gadventures.b.ssl.fastly.net/media-server/dynamic/admin/trip-banners/africa/south-africa/DAKZ/DAKZ.jpg,57,2014-07-05 18:10:31 UTC,2014-07-05 18:10:31 UTC
321,Project South Africa & Overland Adventure,Experience the colour and culture of southern Africa on this unique 28-day volunteer adventure. Soak in the spirit of Cape Town before exploring desert landscapes on your way to the mists of majestic Victoria Falls. Embark on game drives across national parks and explore the Okavango Delta in dugout mokoro canoe. Gain a unique perspective on local culture while volunteering with community projects that help bring education to the Cape Peninsula. Give a little of your time to Africa and take away a truly immersive experience that few travellers encounter.,28,https://gadventures.b.ssl.fastly.net/media-server/dynamic/admin/maps/2012/DAPS.jpg,https://gadventures.b.ssl.fastly.net/media-server/dynamic/admin/trip-banners/africa/south-africa/DAPS/DAPS_banner_south_africa_elephant_grass.jpg,58,2014-07-05 18:10:32 UTC,2014-07-05 18:10:32 UTC
322,South Africa Volunteer and Overland Adventure,Experience the colour and culture of southern Africa on this unique 28-day volunteer adventure. Soak in the spirit of Cape Town before exploring desert landscapes on your way to the mists of majestic Victoria Falls. Embark on game drives across national parks and explore the Okavango Delta in dug-out mokoro canoe. Gain a unique perspective on local culture while volunteering with community projects that help bring education to the Cape Peninsula. Give a little of your time to Africa and take away a truly immersive experience that few travellers encounter.,28,https://gadventures.b.ssl.fastly.net/media-server/dynamic/admin/maps/2013/DAPS.png,https://gadventures.b.ssl.fastly.net/media-server/dynamic/admin/trip-banners/africa/south-africa/DAPS/DAPS_banner_south_africa_elephant_grass.jpg,58,2014-07-05 18:10:32 UTC,2014-07-05 18:10:32 UTC
323,South Africa & Swazi Quest,"The unvarnished grandeur of South Africa is on display in this comprehensive exploration of one of the continent’s most diverse and fascinating destinations. Wildlife and Africa’s incredible culture is at a premium on this tour—from the coastal shores of Tsitsikamma to extensive game drives in Addo Elephant National Park and the famed Kruger. You’ll also have the chance to visit a traditional Swazi village, explore modern Cape Town, and follow the glorious Garden Route. Add in knowledgeable CEOs and some of the best camp meals you’ve ever tasted and you’ve got a recipe for adventure par excellence.",17,https://gadventures.b.ssl.fastly.net/media-server/dynamic/admin/maps/2012/DASQ.jpg,https://gadventures.b.ssl.fastly.net/media-server/dynamic/admin/trip-banners/africa/south-africa/DASQ/DASQ.jpg,57,2014-07-05 18:10:33 UTC,2014-07-05 18:10:33 UTC
324,Cape Town to Joburg Adventure,"Like action, adventure and wildlife documentaries? Then you’re going to flat-out love this trip. The itinerary reads like a special double-issue of your favourite travel mag: towering sand dunes, impossibly deep canyons, game drives in Etosha, Kruger and Matobo national parks, the bone-shaking roar of Victoria Falls, Shaagan village tours, campouts under a sprawling blanket of stars—and that’s just a sample! With expert CEOs and loads of optional activities available each day, you’ll run out of time before you run out of things to do, see and experience.",28,https://gadventures.b.ssl.fastly.net/media-server/dynamic/admin/maps/2012/DATJ.png,https://gadventures.b.ssl.fastly.net/media-server/dynamic/admin/trip-banners/africa/south-africa/DATJ/DATJ.jpg,58,2014-07-05 18:10:33 UTC,2014-07-05 18:10:33 UTC
325,Ultimate Africa,"Spanning eight countries, this journey is full of diverse cultures, abundant wildlife, spectacular landscapes, stunning beaches and a ton of adventure. Track the 'Big 5' across open savannah, explore the Okavango Delta in a dug out mokoro canoe, encounter gorillas deep in the Ugandan wilderness—do it all on this ultimate 54-day adventure and get a real feel for how large Africa really is. Travel aboard our rugged overland truck is well-paced. while wilderness camping will bring you closer to the region’s wildlife. Encounter rare wildlife and real people on this unique and cost-effective journey through the stunning scenery of Southern and East Africa.",54,https://gadventures.b.ssl.fastly.net/media-server/dynamic/admin/maps/2012/DAUA.jpg,https://gadventures.b.ssl.fastly.net/media-server/dynamic/admin/trip-banners/africa/south-africa/DAUA/DAUA_banner_africa_wildlife_lion.jpg,58,2014-07-05 18:10:33 UTC,2014-07-05 18:10:33 UTC
