516,Crete Hike & Kayak,"Hike through rugged forest, kayak to picturesque fishing villages and uncover the natural beauty of Crete on this compact trip jam-packed with adventure. Trek along trails deep into Samaria Gorge and witness the views at Agia Irini. Paddling your kayak past magnificent scenery to secluded beaches, you'll have plenty of chances to dive in and savour the turquoise waters. Encountering Crete and enjoying a meal with a local family will allow you to explore a side of this idyllic island that few travelers get to know.",8,https://gadventures.b.ssl.fastly.net/media-server/dynamic/admin/maps/2012/EGCH.png,https://gadventures.b.ssl.fastly.net/media-server/dynamic/admin/trip-banners/europe/greece/EGCH/EGCH_banner_greece_crete_hiking.jpg,101,2014-07-05 18:12:00 UTC,2014-07-05 18:12:00 UTC
517,Local Living Greece: Crete,"Fall in love with Crete on this Local Living adventure. You can visit ancient settlements, attend wine tastings or sit by the harbour and soak up the island's spirit. How you spend your time is up to you. Get active and hike Samariá Gorge—Europe's longest—or the Agia Irini Gorge, or both. You’ll share your home—and its pool—with like-minded travellers but your days are your own. With a CEO there for advice, the only thing you'll need to worry about is never wanting to leave.",8,https://gadventures.b.ssl.fastly.net/media-server/dynamic/admin/maps/2013/EGCL.png,https://farm4.staticflickr.com/3161/2765095758_ae3e79c850_o_d.jpg,101,2014-07-05 18:12:01 UTC,2014-07-05 18:12:01 UTC
518,Greek Islands Discovery,"Gaze out over rugged island coastlines, hike the Samaria Gorge, wander through whitewashed villages and savour meals in local tavernas as you cover the best of Crete, Santorini and Naxos. Beginning with the classical heights of Athens, trade bustling city streets for breaking waves on calm sun-drenched island beaches. Our expert CEOs will reveal the region’s hidden gems, taking the hassle out of travel so you can focus on ancient ruins and vibrant sites—or enjoy yourself with a cold drink on the shores of the islands.",13,https://gadventures.b.ssl.fastly.net/media-server/dynamic/admin/maps/2012/EGID.jpg,https://gadventures.b.ssl.fastly.net/media-server/dynamic/admin/trip-banners/europe/greece/EGID/EGID_banner_greece_islands_church.jpg,100,2014-07-05 18:12:01 UTC,2014-07-05 18:12:01 UTC
519,Inland & Amazon,"From the heights of the Andes to the heat of the Amazon rainforest, experience an incredible land of contrasts on this 16-day journey through Ecuador. Explore the jungle by canoe and stay with a local Quichua family for an extraordinary cultural experience you'll never forget. Scour the market at Otavalo for special treasures and cure what ails you in a mountain hot spring. With its unique variety of accommodation and insight into rural life in the jungle, this is more than just a tour—it's a once-in-a-lifetime experience.",16,https://gadventures.b.ssl.fastly.net/media-server/dynamic/admin/maps/2012/EIA.jpg,https://gadventures.b.ssl.fastly.net/media-server/dynamic/admin/trip-banners/south-america/ecuador/EIA/EIA_banner_ecuador_landscape_volcano.jpg,89,2014-07-05 18:12:02 UTC,2014-07-05 18:12:02 UTC
525,Italy Culture & History Explored,"You were drawn by Europe’s art and culture to Italy—where the ancient rubs shoulders with the modern. Venice’s Doge’s Palace is impressive enough on the surface, but you’ll want to dig deeper and explore its hidden secrets. As night falls, board a vaporetto and glide through renaissance shadows and explore Venice. Indulge your senses in the Tuscan countryside famous for local wines and delicious cuisine. Continue to Rome where a simple turn of the head reveals iconic sights. Don’t let the sensual delights of this historic land remain a mystery—explore Italy’s secrets for yourself.",9,https://gadventures.b.ssl.fastly.net/media-server/dynamic/admin/maps/2012/EICHD.jpg,https://gadventures.b.ssl.fastly.net/media-server/dynamic/admin/trip-banners/europe/italy/EICHD/gap_adv_italy.jpg,104,2014-07-05 18:12:04 UTC,2014-07-05 18:12:04 UTC
526,Cinque Terre Coastal Walk,"Separated from the rest of Italy by the impressive landscape you're here to hike, the rugged villages of the Cinque Terre still remain a world away from the bustle of Rome. Follow coastal trails and discover villages clustered on windswept cliffs and perched above beautiful coastlines. Hike and swim by day and sample the fresh seafood and local delicacies by night. For the active traveller who wants to experience a real slice of Italian life, this compact adventure tops the menu.",5,https://gadventures.b.ssl.fastly.net/media-server/dynamic/admin/maps/2012/EICW.jpg,https://gadventures.b.ssl.fastly.net/media-server/dynamic/admin/trip-banners/europe/italy/EICW/EICW_banner_italy_cities_cinque_terre_night.jpg,105,2014-07-05 18:12:05 UTC,2014-07-05 18:12:05 UTC
527,Trekking in the Dolomites,"Beloved by mountaineers and nature lovers alike, the Dolomites sit perched atop northern Italy like a rocky crown. This exhilarating trip through the mountains features day treks through some of Italy’s most unbelievable scenery, with plenty of visits to small villages along the way to soak up the unique local Ladin culture and cuisine. Nights are spent in mountain refuges, where your hosts will ply you with hearty home-cooked meals. Eat up; you won’t find tastier mountain-trekking food anywhere else.",10,https://gadventures.b.ssl.fastly.net/media-server/dynamic/admin/maps/2013/EIDT.png,https://gadventures.b.ssl.fastly.net/media-server/dynamic/admin/trip-banners/europe/italy/EIDT/EIDT-iStock_000017346777Large.jpg,106,2014-07-05 18:12:06 UTC,2014-07-05 18:12:06 UTC
528,Local Living Italy—Tuscany San Gimignano,"If you’ve ever wanted to forge a deeper bond with a destination, this is your chance. Centred in San Gimignano, this Local Living adventure places you in the heart of central Tuscany. You’re free to explore the town, visit vineyards, discover medieval highlights or embrace your inner artist wandering the Tuscan countryside. If you’re looking for a deeper dive into Italian cities, there’ll be day trips to visit Siena and Florence. You’ll share the main accommodation with like-minded travellers, and with a CEO there to point you in the right direction, prepare to fall in love with Italy.",7,https://gadventures.b.ssl.fastly.net/media-server/dynamic/admin/maps/2014/EIGL.png,https://gadventures.b.ssl.fastly.net/media-server/dynamic/admin/trip-banners/europe/italy/EIGL/EIGL-Italy-SouthTuscany-Local-Living-POV-get-poured-some-red-wine-LeonardoTamburri-2012-IMGP9223.jpg,103,2014-07-05 18:12:06 UTC,2014-07-05 18:12:06 UTC
529,Winter in Italy with Venice Carnival,"Peel back the mask and uncover the secrets of Venice during the legendary Carnival. From the marvels of St Mark's Square to the exuberant crowds in full costume, Venice is a feast for the senses. Feel the pull of mystery at the Bridge of Sighs and visit the tiny fishermen's island of Burano, known for its lace-making and painted houses. Explore Byzantine basilicas and the famous traditional glass-blowing studios of Murano. And of course, immerse yourself in the sounds and energy of the crowds on festival night. Add in the highlight cities of Rome and Florence and you have a trip you'll never forget.",9,https://gadventures.b.ssl.fastly.net/media-server/dynamic/admin/maps/2015/EIIC.png,https://farm6.staticflickr.com/5215/5515851165_1939773e43_o_d.jpg,103,2014-07-05 18:12:06 UTC,2014-07-05 18:12:06 UTC
530,Local Living Italy: Rome,"Rome has been a world capital for millennia—give yourself the time needed to get acquainted. This Local Living option situates you in a comfortable apartment—kitchen, wi-fi, dining area—within walking distance to St Peter's Basilica and Vatican City. Spend your time exploring Roman ruins, medieval sites and Renaissance highlights. You’ll share your home with like-minded travellers but your days are your own. You can’t rush a love affair—take it slow and fall in love with one of Europe’s most impressive cities.",8,https://gadventures.b.ssl.fastly.net/media-server/dynamic/admin/maps/2013/EILL.png,https://farm3.staticflickr.com/2726/12971867895_f40371623f_o_d.jpg,103,2014-07-05 18:12:07 UTC,2014-07-05 18:12:07 UTC
531,Local Living Italy: Puglia,"Some destinations are best experienced quickly in a single gulp. Puglia, on the other hand, is a place you sip and savour slowly. From a charming apartment inside the walls of an ancient city, this Local Living trip to Italy’s boot heel puts you in close contact with the people who are lucky enough to live here full-time. Discover the culinary secrets of the region’s age-old winemaking and olive oil trades, learn to make your own pasta, bike down dozens of scenic trails or simply soak up the splendour of your surroundings. Above all, make yourself at home.",8,https://gadventures.b.ssl.fastly.net/media-server/dynamic/admin/maps/2013/EIPL.png,https://gadventures.b.ssl.fastly.net/media-server/dynamic/admin/trip-banners/europe/italy/EIPL/EIPL-IMG_6672.jpg,107,2014-07-05 18:12:07 UTC,2014-07-05 18:12:07 UTC
532,Rome to London Adventure,"With just 17 days to play with, time is tight on this tour, but the possibilities (and options) are wide-open. It begins in Rome, home to more ancient landmarks than you could shake a centurion’s spear at. From there, you’ll explore elegant Prague, cut loose in the clubs of Amsterdam and Berlin, and savour the historical charms of romantic Bruges before the whirlwind drops us off in England. Hang on tight.",17,https://gadventures.b.ssl.fastly.net/media-server/dynamic/admin/maps/2012/EIRL.jpg,https://gadventures.b.ssl.fastly.net/media-server/dynamic/admin/trip-banners/europe/italy/EIRL/EIRL.jpg,103,2014-07-05 18:12:07 UTC,2014-07-05 18:12:07 UTC
533,Rome to Prague Adventure,"This trip is perfect for the young, budget-conscious traveller eager to check a bunch of boxes off their travelling to-do list in one fell swoop. Beginning in Rome—the crucible of Western civilization—and wrapping up in beautiful Prague, you’ll sample the regional specialties and delicious wines of Italy, get in touch with the continent’s rich culture in famed museums and galleries, and compare dance floors in the nightclubs of Europe’s party capitals.",10,https://gadventures.b.ssl.fastly.net/media-server/dynamic/admin/maps/2013/EIRP.png,https://gadventures.b.ssl.fastly.net/media-server/dynamic/admin/trip-banners/europe/italy/EIRP/EIRP.jpg,103,2014-07-05 18:12:07 UTC,2014-07-05 18:12:07 UTC
534,Trekking in Tuscany,"The difference between a tourist and a traveller? Tourists visit. Travellers explore. And once you’ve seen, smelled, felt, and tasted northern Tuscany, you’ll want to devour as much of it as possible. This journey into Garfagnana – one of Italy’s top trekking regions – offers plenty of exercise for mind, body, and soul alike. Over seven days, you’ll hike the unspoiled mountains by day, learn to prepare delicious local cuisine in the evening, and put your well-used feet up at the end of it all to soak in the simple pleasures of country life.",7,https://gadventures.b.ssl.fastly.net/media-server/dynamic/admin/maps/2014/EIRT.png,https://gadventures.b.ssl.fastly.net/media-server/dynamic/admin/trip-banners/europe/italy/EITG/EITG-Italy-Female-Hiking-Bird-Watching-IS-9456280-Lg-RGB.jpg,103,2014-07-05 18:12:07 UTC,2014-07-05 18:12:07 UTC
535,Ultimate Italy,"From the villages of the Cinque Terre to Tuscany's medieval splendour, this is an adventure for those looking to indulge in all of Italy’s delights. Walk through grand piazzas and winding lanes, stroll the canals of Venice and float past villas on Lake Como. Marvel at the ancient grandeur of Rome and the Renaissance masterpieces of Florence. Your CEO will take care of the details so you can travel at a leisurely pace and appreciate the scenery, whether it’s sipping vino in Tuscany or sampling local delicacies within the walls of charming Lucca. Experience the best of Italy in this all-encompassing tour.",14,https://gadventures.b.ssl.fastly.net/media-server/dynamic/admin/maps/2014/EIRV.png,https://gadventures.b.ssl.fastly.net/media-server/dynamic/admin/trip-banners/europe/italy/EIUL/EIUL_banner_italy_venice_gondolas.jpg,103,2014-07-05 18:12:08 UTC,2014-07-05 18:12:08 UTC
536,Local Living Italy: Sicily,"Trade the hustle and bustle of the mainland for eight soul-soothing days immersed in the agrarian coziness of Sicily. On this unique Local Living departure, you’ll get an up-close-and-personal glimpse of everyday life on this laidback island from three different yet equally charming towns, with five of the nights in a comfortable apartment. By day, you’ll stroll the streets of baroque Catania, the beautiful fishing village of Acitrezza, and the tiny, volcano-ringed Lipari—considered by some to be the 'Sicilian Santorini'. Pleasant seaside strolls? Volcano hikes? Kayaking excursions? Loads of downtime? Why leave?",8,https://gadventures.b.ssl.fastly.net/media-server/dynamic/admin/maps/2013/EISL.png,https://gadventures.b.ssl.fastly.net/media-server/dynamic/admin/trip-banners/europe/italy/EISL/EISL-IMG_6273.jpg,108,2014-07-05 18:12:08 UTC,2014-07-05 18:12:08 UTC
537,Local Living Italy—Sorrento,"Get a taste for Italian life on this one-week trip to Sorrento, located just around the corner from the Amalfi Coast. Replete with gorgeous scenery and all the fantastic food and drink you’d expect, you’ll unwind on an organic lemon farm where a local family will be your hosts, giving you an in-depth look at what life at an Italian agriturismo is like. And of course, there will be food demonstrations, including limoncello- and pizza-making as well as a walk along the stunning coastline, a visit to the elite island of Capri and a stop at Pompeii. Don’t be a tourist in Italy—live the dream.",7,https://gadventures.b.ssl.fastly.net/media-server/dynamic/admin/maps/2014/EISO.png,https://gadventures.b.ssl.fastly.net/media-server/dynamic/admin/trip-banners/europe/italy/EIST/EIST.jpg,102,2014-07-05 18:12:08 UTC,2014-07-05 18:12:08 UTC
538,Southern Tuscany Local Living,"Experience life the local way and you’ll experience a Tuscany that most tourists miss. This trip offers plenty of opportunity to get your hands dirty in the kitchen as you’ll learn to shop for, prepare and enjoy this picturesque region’s culinary and viticultural delights. Peruse the local markets and delis in search of the finest organic fare, sample wines in the very vineyards that spawned them, and work off all that deliciousness with active walks and bike rides across some of the world’s most beautiful scenery. Just start forwarding your mail here now.",7,https://gadventures.b.ssl.fastly.net/media-server/dynamic/admin/maps/2012/EIST.png,https://farm4.staticflickr.com/3792/9499097340_4c5a07e51c_o_d.jpg,103,2014-07-05 18:12:09 UTC,2014-07-05 18:12:09 UTC
539,Local Living Italy - Southern Tuscany,"Experience life the local way and you’ll experience a Tuscany that most tourists miss. This trip offers plenty of opportunity to get your hands dirty in the kitchen as you’ll learn to prepare and enjoy this picturesque region’s culinary and viticultural delights. Peruse the local markets and delis in search of the finest organic fare, sample wines in the very vineyards that produced them, and work off all that deliciousness with walks through some of the world’s most beautiful scenery. Just start forwarding your mail here now.",7,https://gadventures.b.ssl.fastly.net/media-server/dynamic/admin/maps/2014/EIST_1.png,https://gadventures.b.ssl.fastly.net/media-server/dynamic/admin/trip-banners/europe/italy/EILL/EILL-Italy-Tuscany-Local-Living-YNFI-winner-RItu-cooking-class-IMG_4423.jpg,103,2014-07-05 18:12:09 UTC,2014-07-05 18:12:09 UTC
540,Cycling in Tuscany,"In a country famed for its extensive (not to mention delicious) culinary traditions, Tuscany is top dog. And what better way to work up an appetite for all those gastronomic delights than by taking a ride through some of the most gorgeous countryside you’ll find anywhere? On this trip, you’ll explore the rolling hills and tiny villages of this idyllic patch of Europe from the seat of a bike, then dig in to expertly prepared meals and flavourful wines drawn from the land you’ve spent all day traversing. If you really are what you eat, expect to become exquisite.",7,https://gadventures.b.ssl.fastly.net/media-server/dynamic/admin/maps/2013/EITC.png,https://gadventures.b.ssl.fastly.net/media-server/dynamic/admin/trip-banners/europe/italy/EITC/EITC-Italy-South-Tuscany-Local-Living-Active-cycling-IMGP8942.jpg,103,2014-07-05 18:12:09 UTC,2014-07-05 18:12:09 UTC
541,Amalfi Family Adventure,"Eager to expose the kids to Italian cuisine that doesn’t come in a cardboard box in 30 minutes or less? Take ‘em to the Amalfi Coast. Long a secluded hideaway for adults, the Coast has the most for the younger set as well. Based in smaller towns amidst truly breathtaking scenery, there's a huge variety of activities for your family. Try a delicious cooking class, see the ruins of the doomed city of Pompeii, hike the hills of Tre Calli, explore Capri and more, all in a breezy and affordable seven days. This is pizza’s ancestral home, after all. Deliver yourself to its doorstep.",8,https://gadventures.b.ssl.fastly.net/media-server/dynamic/admin/maps/2013/EITF.png,https://gadventures.b.ssl.fastly.net/media-server/dynamic/admin/trip-banners/europe/italy/EIFA/EIFA_banner_italy_laundry.jpg,102,2014-07-05 18:12:09 UTC,2014-07-05 18:12:09 UTC
542,Trekking in Tuscany,"The difference between a tourist and a traveller? Tourists visit. Travellers explore. And once you’ve seen, smelled, felt and tasted northern Tuscany, you’ll want to devour as much of it as possible. This journey into Garfagnana—one of Italy’s top trekking regions—offers plenty of exercise for mind, body and soul alike. Over eight days, you’ll hike the unspoiled mountains by day, learn to prepare delicious local cuisine in the evening and put your well-used feet up at the end of it all to soak in the simple pleasures of country life.",8,https://gadventures.b.ssl.fastly.net/media-server/dynamic/admin/maps/2013/EITG.png,https://gadventures.b.ssl.fastly.net/media-server/dynamic/admin/trip-banners/europe/italy/EITG/EITG-Italy-Female-Hiking-Bird-Watching-IS-9456280-Lg-RGB.jpg,109,2014-07-05 18:12:10 UTC,2014-07-05 18:12:10 UTC
543,Treasures of Italy,Artists have always travelled to Italy to lift their spirits. This 2-week adventure offers you the same opportunity. Connect with the ancients at the ruins of Pompeii and in Rome and marvel at the Renaissance in Venice and Tuscany. You’ll explore tiny markets and walk the hills of Cinque Terre and with the gods in Amalfi. We’ve taken care of the planning so you’ll have plenty of time for solo exploring and optional activities. Connect with the culture—past and present—and discover what visitors have always known: the heart beats faster in Italy.,14,https://gadventures.b.ssl.fastly.net/media-server/dynamic/admin/maps/2013/EITI.png,https://farm1.staticflickr.com/114/284699010_feda2a232d_o_d.jpg,104,2014-07-05 18:12:10 UTC,2014-07-05 18:12:10 UTC
544,Italy Photography tour with Gary Arndt,"EVERYTHING EVERYWHERE – PHOTOGRAPHING ITALY
Save room in your luggage for extra memory cards, shutterbugs; on this travel photography tour through picturesque Italy, every second is a picture-perfect photo-op. From the inspiring ancient architecture of Venice and Rome to the rolling, impossibly lush hills of Tuscany, your shutter-finger is destined to get one hell of a workout. Best of all, you’ll get expert guidance in photography, travel writing and adventuring from our Wanderer-in Resident Gary Arndt, founder of Everything Everywhere, the internet’s most-visited travel blog. Between characteristic Renaissance flourishes, the somber beauty of Pompeii and plate upon plate of Tuscan cuisine prepared with the greatest care, the hardest decision you’ll have to make is which shot to frame first.",14,https://gadventures.b.ssl.fastly.net/media-server/dynamic/admin/maps/2013/EITIP.png,https://farm5.staticflickr.com/4084/5026699554_b17f73ff8c_o_d.jpg,104,2014-07-05 18:12:11 UTC,2014-07-05 18:12:11 UTC
545,The Taste of Tuscany,"From the masterpieces and museums of Florence to local market stalls bursting with delicious regional meats, cheeses and produce, indulge in the riches of Tuscany. Spend eight days wandering through romantic medieval towns and exploring the Gothic architecture of Siena. Sample the legendary wines of Chianti and seek a unique perspective while gazing at Pisa's iconic tower. With comfortable hotels and an expert CEO to take the hassle out of travel, you'll be relaxed, rested and ready to explore all that Tuscany has to offer.",8,https://gadventures.b.ssl.fastly.net/media-server/dynamic/admin/maps/2012/EITT.jpg,https://gadventures.b.ssl.fastly.net/media-server/dynamic/admin/trip-banners/europe/italy/EITT/EITT_banner_italy_tuscany_hills_farm.jpg,110,2014-07-05 18:12:11 UTC,2014-07-05 18:12:11 UTC
546,Ultimate Italy,"From the villages of Cinque Terre to Tuscany's medieval splendour, this is an adventure for those looking to indulge in all of Italy’s delights. Walk through grand piazzas and winding lanes, stroll the canals of Venice and float past villas on Lake Como. Marvel at the ancient grandeur of Rome and the renaissance masterpieces of Florence. Your CEO will take care of the details so you can travel at a leisurely pace and appreciate the scenery, whether it’s sipping vino in Tuscany or sampling local delicacies in Florence's markets. Experience the best of Italy in this all-encompassing tour.",13,https://gadventures.b.ssl.fastly.net/media-server/dynamic/admin/maps/2012/EIUL.jpg,https://gadventures.b.ssl.fastly.net/media-server/dynamic/admin/trip-banners/europe/italy/EIUL/EIUL_banner_italy_venice_gondolas.jpg,103,2014-07-05 18:12:12 UTC,2014-07-05 18:12:12 UTC
547,Ultimate Italy Christmas Time,"From the delightful small towns of Umbria to Venice's splendour, this is an adventure for those looking to indulge in Italy’s delights at Christmas time, when the crowds are fewer and the food and drink in even greater abundance than usual. Marvel at the Renaissance glories of Tuscany and sample the cuisine of Emilia-Romagna in Ravenna. Your CEO will take care of the details so you can travel at a leisurely pace and appreciate the scenery. Experience the best of Italy in midwinter in this all-encompassing tour.",13,https://gadventures.b.ssl.fastly.net/media-server/dynamic/admin/maps/2012/EIULC.png,https://gadventures.b.ssl.fastly.net/media-server/dynamic/admin/trip-banners/europe/italy/EIULC/EIULC_tuscany.jpg,103,2014-07-05 18:12:12 UTC,2014-07-05 18:12:12 UTC
548,Ultimate Italy: Winter,"From the delightful small towns of Umbria to Venice's splendour, this is an adventure for those looking to indulge in Italy’s delights in the winter, when the crowds are fewer and the food and drink in even greater abundance than usual. Marvel at the Renaissance glories of Tuscany and sample the cuisine of Emilia-Romagna in Bologna. Your CEO will take care of the details so you can travel at a leisurely pace and appreciate the scenery. Experience the best of Italy in winter in this all-encompassing tour.",13,https://gadventures.b.ssl.fastly.net/media-server/dynamic/admin/maps/2014/EIULC_1.png,https://farm8.staticflickr.com/7079/7348861786_4d89c2d257_o_d.jpg,103,2014-07-05 18:12:12 UTC,2014-07-05 18:12:12 UTC
549,Venice Carnival,"Peel back the mask and uncover the secrets of Venice during the legendary Carnival. From the marvels of St Mark's Square to the exuberant crowds in full costume, Venice is a feast for the senses. Feel the pull of mystery at St Mark’s Basilica and visit the tiny fishermen's island of Burano with its painted houses. Explore Byzantine Basilicas and the famous traditional glass-blowing studios of Murano. And of course, immerse yourself in the sounds and energy of the crowds on festival night.",5,https://gadventures.b.ssl.fastly.net/media-server/dynamic/admin/maps/2012/EIVC.jpg,https://gadventures.b.ssl.fastly.net/media-server/dynamic/admin/trip-banners/europe/italy/EIVC/EIVC_venice.jpg,104,2014-07-05 18:12:12 UTC,2014-07-05 18:12:12 UTC
550,Croatia and the Balkans,"The Balkans are just getting noticed as a great European travel destination - we can’t believe it took so long! Situated on the balmy shores of the Adriatic and home to some of the most wondrous landscapes, monuments and villages you’ll ever see, this part of the world still feels like a well-kept secret. This adventure showcases the region’s compelling history and scenery and allows time for outdoor pursuits like kayaking and hiking. You may not know much about Croatia and the Balkans now, but once you’ve been, you’ll be hard-pressed to stop talking about them.",15,https://gadventures.b.ssl.fastly.net/media-server/dynamic/admin/maps/2014/EJBT.png,https://gadventures.b.ssl.fastly.net/media-server/dynamic/admin/trip-banners/europe/croatia/ECCH/ECCH_banner_croatia_pucisca_brac_island.jpg,81,2014-07-05 18:12:13 UTC,2014-07-05 18:12:13 UTC
